,link,datePublished,dateModified,title,text,linkImage,classification
22,https://www.saude.gov.br/component/content/article/1361-fake-news/46578-colocar-luvas-para-manusear-dinheiro-e-evitar-coronavirus-e-verdade,2020-03-23 13:30:01,2020-03-23 13:30:01,Colocar luvas para manusear dinheiro e evitar coronavírus ,"ewac - A Encaminhada Não quero assustar ninguém, mas o coronavírus se espalhará irreversivelmente : em breve. E a principal forma de se infectar será através das notas de dinheiro. Portanto, colete todas as suas notas com luvas e coloque-as em um envelope plástico selado. Neste final de semana estarei recolhendo esses envelopes em suas residências. Peço apenas que agendem os horários de retirada aqui. O serviço é totalmente gratuito, o faço apenas em nome da saúde pública e em | consideração a todos os membros do grupo. ESTA NOTÍCIA É VERDADEIRA, 13:28 Nesse casonao cabe uma respostarde verdadeito oufalso sabemos que elunma brincadeira mas existe possiblidade de trahsnmissão pelo dinheiro 等4。 dempegaro:COVID 19 dexoutras pessoas que têmovirUS AS pesso doenca pode se espalhar de pessoa para pessoaratraves de pequenas goticulas do nanzourda boca que se espalhamiguando uima pessoarCom.COVID-19 tosse Ourespina. Essas gotidulas pousamem objetosesuperfices proximasassim outtas pessoasipodem se infectancom o COVID 19 tocando esseS objetos ou Superficies e depois tocandonosolhos narizou boca AS pessoas tambem podemipegar COVID 19 se respirarem goticulas de uma pessoa com COVID 19 quettosse ouresplra E porisso que e importante ficar a mais denimetro de uma: pessoa doente ",https://www.saude.gov.br/images/jpg/2020/marco/23/fake9.jpg,0
23,https://www.saude.gov.br/component/content/article/1361-fake-news/46577-tomar-ou-bebidas-quentes-para-matar-o-coronavirus-e-fake-news,2020-03-23 13:28:02,2020-03-23 13:28:02,Tomar ou bebidas quentes para matar o coronavírus ,"SAIDEADVERTE A Encaminhada Meu médico Patrick Martin acabou de me enviar o seguinte: Para ler muito interessante: NÃO PARAMOS O VÍRUS COM PÂNICO. MAS POR INTELIGÊNCIA! ISTO É FAKE Acabei de fazer a tradução do texto em italiano recebido. Estou enviando gradualmente para todos os meus amigos que falam francès, por isso não hesite em transferi-lo o máximo possível. Essa informação vem de médicos atualmente na linha de frente do combate ao vírus. que podem ajudar um grande número de pessoas. COPIAR. IMPRIMIR, PASSARI Amanda Castello. NEWS! ""Não paramos o vírus com pánico, mas com inteligėncia. Aqui estão novas informações de um pesquisador de Shenzhen transferido para Wuhan para trabalhar com a força-tarefa da epidemia de Coronavirus. As informações a seguir são claras, simples e acessiveis a todos, descrevendo exatamente o que é o vírus, como é transmitido de pessoa para pessoa e como pode ser neutralizado na vida cotidiana. Ponque e falso o diagnosticordepende da Kivestigação dnico epidemiologica e do exame fisico, A infecção por coronavírus não se apresenta como o resfriado habitual, com corrimento nasal ou tosse com cátaros e escarro, mas. pelo contrário, com tosse seca. Este é o primeiro sinal para identificar corretamente. 報。 Importante saber: o vírus não resiste ao calor e morre se for exposto a temperaturas de 26 a 27. Portanto, é muito importante consumir durante o dia todas as bebidas quentes possíveis, como chá, chá de ervas, caldo, sopas ou simplesmente água quente. O liquido quente neutraliza o vírus e não é difícil absorvė-lo. OMinistério da saude orienta Cuidados basicos para reduzIro: riSGogeralde contrai ou transmitiriinfeccoes Cespiratorlas ağudas indlundo I'Ocotonavirus COVID.19). Importante: Evite beber ägua gelada ou sugar gelo ou neve para aqueles que estão nas montanhas, principalmente crianças. Para quem pode, é importante expor-se o máximo possível ao sol, de acordo com as condições climáticas atuais. ESTA MCTICIA ",https://www.saude.gov.br/images/jpg/2020/marco/23/fake3.jpg,1
24,https://www.saude.gov.br/component/content/article/1361-fake-news/46576-coronavirus-morre-a-26-c-e-fake-news,2020-03-23 13:25:28,2020-03-23 13:25:28,Coronavírus morre a 26o C ,"SAIDEADVERTE -.... Unicef ISTO É O Corona vírus é maior do que o normal; o diâmetro da célula é de 400 a 500 mícrons e, por esse motivo, qualquer máscara impede a sua entrada no organismo. FAKE O vrus não se propaga no ar. NEWS! O coronavírus, quando cai sobre uma superfície de metal, permanece vivo durante 12 horas. Lavar as mãos com água e sabão é suficiente para o destruir. O corona virus quando cai sobre num tecido, permanece vivo durante 9 horas, portanto, lavar a roupa ou colocá-la ao sol durante 2 horas, será suficiente para o eliminar. O vírus só vive nas mãos durante 10 minutos. Assim, usar um desinfetante em gel também o eliminará. Roqueeaso Atemperaturado compo humano e de pelo menos 36G assim beberaguna uma Temperaturarde 26a 27Cnao raz benefido algtimemtelacao. a prevencao oueliminação do coronavirus COVID 19.oma vezqueno corpothumano.oI VIUS toleratemperatura de pelo menos36°C O vírus exposto a uma temperatura de 26 a 27 C morre. A água que esteja exposta ao sol poderá ser consumida sem qualquer perigo. Evitar comer gelados ou pratos frios; os alimentos quentes são mais seguros, visto que o calor elimina o vírus. Gargarejar com água morna ou salgada mata os vírus que se alojem nas amigdalas e evita que passem para os pulmões. Estas medidas são suficientes para evitar a ocorrência e propagação do vírus em qualquer parte do mundo. UNICEF 14:24 STA MOTICIA ",https://www.saude.gov.br/images/jpg/2020/marco/23/fake2.jpg,1
25,https://www.saude.gov.br/component/content/article/1361-fake-news/46575-audio-do-professor-titular-de-cirurgia-toracica-da-usp-hc-incor-e-verdade,2020-03-23 13:23:26,2020-03-23 13:23:26,Áudio do professor titular de cirurgia torácica da USP/HC/Incor ,"Encaminhada Recebi esse audio do Fabio Jatene Prof titular de cirurgia toracica da USP/HC/Incor. A voz é dele mesmo. 17:17 A Encaminhada 6:29 17:18 O Brasilse antecipou no conmbate ao Coronavitus Entre as acoes do Ministerio da Saudeunto com estados e municipios estaoa ampliação do horano de funcionamento dos postos de saude, Contrataçãode Smilmédicos distibuição de testes derdiagnostico paratodo o Brasilre contratacao de letos do Ui. DA SAUDE AD ERIO. ESTA NOTÍCIA É VERDADEIRA, COMPAR ",https://www.saude.gov.br/images/jpg/2020/marco/23/fake1.jpg,0
26,https://www.saude.gov.br/component/content/article/1361-fake-news/46515-agua-ou-cha-quente-mata-o-coronavirus-e-fake-news,2020-03-09 19:41:58,2020-03-09 19:41:58,Água ou chá quente mata o coronavírus ,"A Encaminhada Amigos. Trata-se de um artigo escrito por um médico pesquisador que se transferiu de Shenzen para WUHAN para estudar mais profundamente o CORONA VIRUS. Ele traz informações interessantes, que tentarei sumarizar pra você. 1-o vírus é fraco e não resiste ao calor. Temperaturas de 26 ou 27° C já matam o dito cujo. 2 - uma das características do vírus é a tosse seca. Por 3 a 4 dias ele fica restrito à garganta. Assim, nesta fase fazer gargarejos já ajuda a minimizar o impacto. A 2a fase da doença dura 5 a 6 dias e nesta fase o vírus causa coriza e também infecta os pulmões causando pneumonia. A doença vencida este prazo se torna letal.a pessoa tem a sensação de estar respirando debaixo d'água. |3-0 vírus fica resistente nas mãos por 10'. Assim, lavar as mãos | frequentemente é muito importante é eficaz. Mas, deve-se evitar coçar os olhos ou nariz pois ele se propaga fácil. 4 -o virus é muito mais resistente em superficies metálicas onde pode se ISTO É FAKE NEWS! manter vivo por até 12 horas. Assim, evitar passar as mãos em corrimãos é importantíssimo. 5- Conselhos: Beber água quente ou chás quentes para matar o vírus. E se puder mande pra frente. ST Valeu? 14:32 OPorqueéfalso VASinformacoesisobre o coronavirus (GOVID 19estão enradas NATE omomentol nao hanenhumimedicanmento cha, substanda vitamina alimento especitico.oU vacinalgue pOSsa prevenira infeccao pelo coronavirus ADHERYE HNISTERIO ESTA MUTKEIAR ",https://www.saude.gov.br/images/jpg/2020/marco/09/fake6.jpg,1
27,https://www.saude.gov.br/component/content/article/1361-fake-news/46514-beber-agua-quente-mata-o-coronavirus-e-fake-news,2020-03-09 19:39:43,2020-03-09 19:39:43,Beber água quente mata o coronavírus ,"A Encaminhado Recebi essa informação sobre o Coronavírus pelo line de uma amiga japonesa essa noite e gostaria de repassar para vcs, espero que possa ajudar!!O ISTO É o informações importantes sobre o Coronavirus FAKE NEWS! | Eu recebi essa corrente de um amigo. i Uma pessoa que trabalha em uma instituição médica me forneceu informações de contramedidas para coronavírus. Vou compartilhar com quem cuida de público e privado. | Por favor, espalhe a informação. A autodefesa é fundamental. Este coronavírus foi considerado muito sensivel ao calor. i sua resisténcia ao calor, pode matar a temperaturas de 26 a 27 graus. Então, por favor, beba mais água quente. Beber água quente também é eficaz para todos os vírus. Coisas frias são estritamente proibidas. Desde o final de fevereiro até o final de março, existem muitas infecções por virus. QUPonque efalso Atemperaturado corpo humano e de pelomenosB6Gassim beberaguaa uma temperatura de 26 a 277Cnao traz benefiao algom em relaçãda prevencaotou eliminação do Cotoravirus (COVID 19zuma vezque no corpo humanoro virustolera temperaturade pelo menos 36 C Por favor, leve chá quente com você em garrafas térmicas quando sair. · Se vocé não puder sair com uma garrafa térmica com chá, procure beber água quente ou beba algo quente com mais frequência. ! Agora que as medidas nacionais estão atrasadas, cada individuo deve agir com ; responsabilidade e ter muito cuidado para não se espalhar mais! Suplemento É eficaz para chá contendo catequina e tomar um banho mais : quente que a temperatura corporal. A catequina tem efeito antiviral, e o banho quente aumenta a imunidade. Mas cuidado com os choques térmicos. ! Além disso, considere que o periodo de incubação é de 27 dias. Informações i de instituições privadas de pesquisa (Medical University) e no exterior (EUA). Uma instituição médica em Fukuoka (Universidade Médica) disse: ""Está se . espalhando por todo o Japão apenas porque não foi testado"". ""O número de pessoas aumentará acentuadamente à medida que os testes começarem agora"". Não seria estranho se pessoas ao seu redor ja estiverem com o virus. Por favor, repassem ao maior número de pessoas essa informação importante. Tenham cuidado, pessoal. Alem disso ate omomentonao ha eenhum medicamento substandia. Vitamina alimento especiticoou vagina igue possa prevenmainfeccão pelo CoronavirusCOVID 19 DE ABHERTE RAMSTERIO ESTA NOTICIA ",https://www.saude.gov.br/images/jpg/2020/marco/09/fake5.jpg,1
28,https://www.saude.gov.br/component/content/article/1361-fake-news/46513-ministerio-da-saude-recomenda-quarentena-aos-viajantes-assintomaticos-para-coronavirus-e-fake-news,2020-03-09 19:37:43,2020-03-09 19:37:43,Ministério da Saúde recomenda quarentena aos viajantes assintomáticos para coronavírus ,"Encaminhada 1° caso de coronavirus no Brasil. Um homem de 61 anos que voltou dia 21/2 de Milão/Itália. A Anvisa vai contatar todos passageiros que vieram no mesmo vôo que ele. Viajar para exterior ficou complicado. Se vc fica num Hotel ou vem num vôo que tem alguém infectado vc tem que ficar de quarentena. Meus Jesus olhai por nós. 12:46 ISTO É Ate omomento,Mnisterio da Saudenão estai recomendando guarentena, devajantesiassintomaticos FAKE NEWS! TA METICIAE BATHISTERIO EDA SAUDE ADYERTE ",https://www.saude.gov.br/images/jpg/2020/marco/09/fake4.jpg,1
29,https://www.saude.gov.br/component/content/article/1361-fake-news/46512-codigo-genetico-do-coronavirus-e-diferente-nos-2-brasileiros-infectados-e-verdade,2020-03-09 19:36:06,2020-03-09 19:36:06,Código genético do coronavírus é diferente nos 2 brasileiros infectados ,"G G1 agora VÍRUS EM MUTAÇÃO Código genético do coronavírus é diferente nos 2 brasileiros infectados OBrasiksequenciou o genoma do coronavrus (COVD19yde: dois casos A ocorrendia de! mutações em vitus jáéi esperada não significay necessariamente que essas KIOdificagões iraogerar. mudanças norcemportamente deviusi ESTA NOTÍCIA É VERDADE!RA, COMPA ADVER ",https://www.saude.gov.br/images/jpg/2020/marco/09/fake3.jpg,0
30,https://www.saude.gov.br/component/content/article/1361-fake-news/46511-coronavirus-fica-vivo-por-9-dias-e-fake-news,2020-03-09 19:33:07,2020-03-09 19:33:07,Coronavírus fica vivo por 9 dias ,Encaminhada Publicação da Nature. Saiu on line. A conclusão é que o corona vírus fica vivo por 9 dias em superfícies inertes. Mas o álcool entre 62 e 70% diminui o tempo para 1 minuto. Conelusion ISTO É Human coronaviruses can remain infectious on inanimate FAKE surfaces for up to 9 days. Surface disinfection with 0.1% sodium hypochlorite or 62e71% ethanol significantly reduces corona- virus infectivity on surfaces within 1 min exposure time. We expect a similar effect against the SARS-COV-2. NEWS! 15:36 ESses estudos pao foramtfeitos dom o Coronoavrus (COVD19massim com.outroS Coronavirus conno OMERS SARSeos.coronavirus endemicos (HCo. RERESTERIO E ,https://www.saude.gov.br/images/jpg/2020/marco/09/fake2.jpg,1
31,https://www.saude.gov.br/component/content/article/1361-fake-news/46510-oleo-consagrado-para-curar-coronavirus-e-fake-news,2020-03-09 19:31:35,2020-03-09 19:31:35,Óleo consagrado para curar coronavírus ,"Ele enviou a sua palavrag curou, e os livrou da mer -Salmos 107.20 O PODER DE DEUS CONTRAO ISTO É CORONAMIBES FAKE NEWS! ESTA RESTICIAS FALSS 01 MAR 19H 0000 lapsilvioribeiro Av. das Indgstribs, 1an, balro So Jolo - Porte Alegro Poquelealso Ate o momento não existe umn tratamento especifico para o. Coronavirus (COVID 19) existem apenas tratamentos experimentais em avaliacão,Adura dos.infectados se da pela propriarespostainmune do organismo, sendo que pessoas.difejentes vao terumacapacidade de resposta diferente aorvirus UDEADVERTE ",https://www.saude.gov.br/images/jpg/2020/marco/09/fake1.jpg,1
32,https://www.saude.gov.br/component/content/article/1361-fake-news/46479-receita-de-coco-que-cura-coronavirus-e-fake-news,2020-03-03 17:23:02,2020-03-03 17:23:02,Receita de coco que cura coronavírus ,"ISTO É FAKE NEWS! :OTCAERLSR- 玩 Por que é falso? Até o momanDO, não hà nenhum medicamenio, Suubstäncia, vitamina, alimente especifico ou vacina que possa pravenir a tnterção pelo cOr Emanvirus (COVI2-T 9). ",https://www.saude.gov.br/images/jpg/2020/marco/03/fake7.jpg,1
33,https://www.saude.gov.br/component/content/article/1361-fake-news/46478-caso-de-coronavirus-confirmado-no-ceara-e-fake-news,2020-03-03 17:15:44,2020-03-03 17:15:44,Caso de coronavírus confirmado no Ceará ,"28/02/2020 ASDE ADNERTE Às 08:30 Confirmado primeiro caso de Corona Vírus no estado do Ceará, na cidade de Itapipoca. ISTO É Paciente veio da cidade de Jericoacoara e após sentir os sintom de itapipoca para consulta. Após prévio diagnóstico foi detectad de Corona Vírus, na mesma hora o paciente foi encaminhado para nospital para realizar novos exames, no qual foi confirmado novamente a presença do vírus, o paciente foi isolado após a detecção e será encaminhado à um hospital particular em Fortaleza. FAKE NEWS! Paciente teve contado com mais de 70 pessoas nas cidades de Jeri, Itapipoca, 15:50 Marco e Tururu. Por que é falso? SO existem (COVID-19) conimados no Brasi, em Sãe Paulo. dots casos do corenavirus ",https://www.saude.gov.br/images/jpg/2020/marco/03/fake6.jpg,1
34,https://www.saude.gov.br/component/content/article/1361-fake-news/46477-caso-de-coronavirus-confirmado-no-piaui-e-fake-news,2020-03-03 17:14:30,2020-03-03 17:14:30,Caso de coronavírus confirmado no Piauí ,"STERO M SADDE A ISTO É DOENÇA MISTERIOSA CHEGA AD 國视ASL O segunda 27 janeiro 95052 ações f Partilhar no Facebook O coronavirus ja se espalhou por quase toda FAKE a China NEWS! ESTA NOTKIAE Autoridades sanitárias confirmaram o primeiro caso de coronavírus no Brasil. O caso foi registrado no Piaui. ALSA O paciente, que não teve sua identidade revelada, é brasileiro e chegou da China na última quinta-feira, dia 23 de janeiro. Desde então, encontra-se em quarentena na Maternidade Marques Basto, na cidade de Parnaiba, litoral do estado. O Ministério da Saúde pede atenção aos Por que é falso? Số existem dois casos do coronavirus (COVID-19) Comfimados no Brasil, em São Pauko. sintomas da enfermidade, que são: dificuldade de respirar, coriza, tosse, dor de garganta e febre, e adverte os grupos de maior risco, como idosos e crianças, que podem desenvolver doenças mais graves ao serem contaminadas com o coronavirus, como pneumonia, sindrome respiratória aguda grave, falha renal e morte. O surto da doença, iniciado na cidade chinesa de Wuhan, tem assustado a população mundial, que teme o inicio de uma nova pandemia, e ja infectou mais de 1000 pessoas, causando mais de 100 óbitos até o momento, f Partilhar no Facebook APNERTE ",https://www.saude.gov.br/images/jpg/2020/marco/03/fake5.jpg,1
35,https://www.saude.gov.br/component/content/article/1361-fake-news/46468-vitamina-c-cura-coronavirus-que-veio-dos-animais-e-agua-com-limao-que-cura-cancer-e-fake-news,2020-03-02 17:21:35,2020-03-02 17:21:35,"Vitamina C cura coronavírus, que veio dos animais, e água com limão que cura câncer ","Boa tarde ISTO É Essa mensagem é correta? FAKE NEWS! STANOTICIA Olá. sou Laila Ahmadi da China estudante da Faculdade de Ciências Médicas da Universidade de Zanjan. O vírus Corona ou COVD-19 chegará a qualquer país mais cedo ou mais tarde. e não há dúvida de que muitos paises não possuem nenhum kit ou equipamento de diagnóstico sofisticado. Por favor, use o máximo de "" vitamina C natural possível "" para fortalecer seu sistema imunológico. Atualmente, o vírus não contém vacina nem tratamento especifico Infelizmente, devido à mutação genética que o tomou muito perigosa. Esta doença parece ser causada pela fusão do gene entre uma cobra e um morcego, e adquiriu a capacidade de infectar mamíferos, incluindo Rorque etalso Otexto contemdiversasinformacoes erradas De acordo comaorganizacão Mundial de saudenãoristenenhuma comprovacao cientitica de queto coronavinus (COVID19 veio dos animais Alem disso ate omomento nào ha nenhumamedicamento substância, vitamina, alimento especitico ouvacna que possa prevenica nfeccaoipelo,. Co onavirus (COVID 19Etambém nao existe um alinmento especifico ou mijagroso para a prevençao elou cural humanos. É importante ter maior conhecimento da doença: o professor Chen Horin, CEO do Hospital Militar de Pequim, disse: ""Fatias de limão em um copo de água morna podem salvar sua vida"". Portanto independentemente do que estiverem fazendo dê uma olhada nesta mensagem e passe para outras pessoas! Limão quente pode matar células cancerigenas! Corte o limão em trés partes e colocado em um copo, depois despeje água quente e transforme-a em (água alcalina), beba todos os dias, definitivamente beneficiará a todos. O tratamento com esse extrato destrói apenas células malignas e não afeta células saudáveis. Segundo: o ácido carboxílico do suco de limão podem regular a pressão alta, proteger artérias estreitas, regular a circulação sanguinea e reduzir a coagulação do sangue. Depois de ler a mensagem transfira-a para a pessoa que você ama e cuide da sua saúde pessoal. Conselho: O professor Chen Horin observa que quem recebe essa mensagem tem pelo menos a garantia de salvar a vida de alguém . 空 た 15:14 RIHASTERIO ",https://www.saude.gov.br/images/jpg/2020/marco/02/fake5.jpg,1
36,https://www.saude.gov.br/component/content/article/1361-fake-news/46467-utilizar-alcool-em-gel-nas-maos-para-prevenir-coronavirus-altera-bafometro-nas-blitz-e-fake-news,2020-03-02 17:16:25,2020-03-02 17:16:25,Utilizar álcool em gel nas mãos para prevenir coronavírus altera bafômetro nas blitz ,ISTO É FAKE NEWS! PorquelefalS0? Ainalaçãorde alcoolem gelaposseurusorcomO medida de higiene pode pumoes porem passados cerca de umrardois minutos o produtoja nao éstaramais presente no organismo Ponisso utilizaralcoolem gel nao Ocasiona nenhuma infracao de transito é duraralguns segundosinos AVERTE ,https://www.saude.gov.br/images/jpg/2020/marco/03/fake11.jpg,1
37,https://www.saude.gov.br/component/content/article/1361-fake-news/46466-bombeiro-afirma-que-ha-mais-de-58-casos-de-coronavirus-no-brasil-e-fake-news,2020-03-02 17:08:42,2020-03-02 17:08:42,Bombeiro afirma que há mais de 58 casos de coronavírus no Brasil ,"Encaminhada EA SAUDE 1:20 08:43 ISTO É FAKE NEWS! 0:49 08:43 Ponque éfalso So existemidoisrcasos dorcoronavirus COVID 19)| Contirmados ho Brasil, ADVERTE CHERASHAN ",https://www.saude.gov.br/images/jpg/2020/marco/02/fake3.jpg,1
38,https://www.saude.gov.br/component/content/article/1361-fake-news/46464-coronavirus-veio-dos-animais-e-fake-news,2020-03-02 15:55:43,2020-03-02 15:55:43,Coronavírus veio dos animais ,"Encaminhada A principal fonte de vírus corona é encontrada. Acontece que muitos telhados em Wuhan, província de Hubei, estão fortemente infestados de morcegos de crisântemo, um tipo de morcego que carrega o vírus em seu corpo. Quando as cobras comem esses morcegos, as cobras se tornam transportadoras secundárias, e quando os chineses comem essas serpentes, elas se tornam transportadoras humanas do vírus e se espalham para os seres humanos através do ar e de outras superfícies estruturais gerais, tossindo, espirrando, coriza, etc. . etc. EA SAUDE 16:22 A Encaminhada ISTO É FAKE NEWS! 3:04 16:22 OHPOT que e falso Deacordo coma Organizagao Mundian de Saude KOMSNnaorexistenenhuma comprovacaoarentifica de que o novo coronavinus vero dos animas, ADHERTE BINISTERIO ",https://www.saude.gov.br/images/jpg/2020/marco/02/fake2.jpg,1
39,https://www.saude.gov.br/component/content/article/1361-fake-news/46463-alcool-em-gel-e-a-mesma-coisa-que-nada-e-fake-news,2020-03-02 15:48:39,2020-03-02 15:48:39,Álcool em gel é a mesma coisa que nada ,"ISTO É FAKE NEWS! Por que é falso? De acordo com evidendas e estudos dentificos SKuais, quido é unm dos métodos e prevenção contra o GoConavrus (COVID-19). Assim come a higienização alas mãos, com água e sabo. O kcool em get ou ESTA ",https://www.saude.gov.br/images/jpg/2020/marco/02/fake1.jpg,1
40,https://www.saude.gov.br/component/content/article/1361-fake-news/46454-e-mail-com-informacoes-de-que-cha-de-erva-doce-cura-coronavirus-e-fake-news,2020-02-28 17:08:18,2020-02-28 17:08:18,E-mail com informações de que chá de erva doce cura coronavírus ,"TERKU DA SAUDEA ISTO É ................ De: Recato Ritcice Data: O12820 1627.24 Para: Renato Bibeice Assunta Coronavirus - cuidados FAKE Assuntor Coronavirus - cuidados Diretor do HC (Hospital das Clinicas) preocupado com a nova gripe, faz as seguintes rocomendaçdes - Farer do alcool gel o nossso aliado. - Começar a tomar vitamina Curgente, cuidar das crianças. -Lavar as mlos muitas vezes ao dia - evitar locais onde haja multidlo, -tomar vitamina C, comer figado de boi, - ingerir sucos de acerola e laranja - Tomar chá de erva-doce duas vezes ao dia. NEWS! ESTA HOSTICIA ERVA-DOCE EPOrque etalS0 Ateomomento nãohậ nenhum nedicamento sulostancia vitamina alimento especifico ou Vacinarque possa reveniraiateccaorpelo: coronavirus (GOVID 19) Ochá de erva-doce tem a mesma subståncia que o modicamento TAMIFLU, o remédio usado para tratar a gripe A - HINI. Aconselha-se tomar o chá como se fosse café, após as refeições. Um infectologista do hospital Slo Domingos, recomenda tomar de 12 em 12 horas o chá de erva doce, pois ele mata o virus da influenza É da erva-doce que é feito o TAMIFLU. * Repasse para seus familiares e amigos pois é muito importante. ",https://www.saude.gov.br/images/jpg/2020/fevereiro/28/fake.jpg,1
