,link,datePublished,dateModified,title,text,linkImage,classification
79,https://www.saude.gov.br/component/content/article/1361-fake-news/46243-pesquisadores-da-ufrj-e-o-novo-coronavirus-e-fake-news,2020-01-29 18:56:19,2020-01-29 18:56:19,Pesquisadores da UFRJ e o novo coronavírus ,"ISTO É FAKE NEWS! A NOTICIA É FALSA - Agora, pesquisadores da Universidade Federal do Rio de Janeiro (UFRJ) confirmam que o vírus também consegue infectar - e se multiplicar em - cérebros adultos, atingindo neurônios mais maduros e provocando, em alguns casos, desde quadros temporários de confusão mental e dificuldade motora até problemas mais graves, de coma ou perda de memória. ERTE: ASIN ",https://www.saude.gov.br/images/jpg/2020/janeiro/29/novo-coronavirus-fake-news4.jpg,1
80,https://www.saude.gov.br/component/content/article/1361-fake-news/46242-foto-da-china-e-o-novo-coronavirus-e-fake-news,2020-01-29 18:38:03,2020-01-29 18:38:03,Foto da China e o novo coronavírus ,NOVO CORONAVÍRUS ÉRIO ISTO É Encaminhada FAKE STANOTÍCIA É FA SA - NÃO DMULG NEWS! 17:22 Encaminhada essa imagem falam que é da China e que não estão mostrando o lado obscuro.isso é fake? 17:22 ADVERTE ,https://www.saude.gov.br/images/jpg/2020/janeiro/29/novo-coronavirus-fake-news3.jpg,1
81,https://www.saude.gov.br/component/content/article/1361-fake-news/46240-sopa-de-morcego-e-o-coronavirus-e-fake-news,2020-01-29 16:18:39,2020-01-29 16:18:39,Sopa de morcego e o coronavírus ,"inteiro, com a barriga aberta. FORA OUTROS TRECOS QUE COMEM DA SAUDE QUE POVO MALUCO ISTO É FAKE NEWS! ESTA NOTÍCIA É FALSA DE ADVERTE MINISTERIO NÃO ĐIAULGUE ",https://www.saude.gov.br/images/jpg/2020/janeiro/29/novo-coronavirus-fake-news2.jpg,1
82,https://www.saude.gov.br/component/content/article/1361-fake-news/46239-cha-e-o-tratamento-do-novo-coronavirus-e-fake-news,2020-01-29 16:16:51,2020-01-29 16:16:51,Chá de erva doce e o tratamento do novo coronavírus ,"Saiba mais acessando saude.gov.br/fakenews 10:33 Gostaria de saber se isso é verdade? 09:36 Encaminhada NOVO CORONAVÍRUS Diretor do Hospital das Clínicas, preocupado com a nova gripe, faz as seguintes recomendações: - Fazer do álcool gel o nossso aliado. - Começar a tomar vitamina C urgente. - Cuidar das crianças. - Lavar as mãos muitas vezes ao dia. - Evitar locais onde haja multidão. - Ingerir sucos de acerola e laranja. - Tomar chá de erva-doce duas vezes ao dia. STERIU LA SAUUEADYERTE ERVA-DOCE: por que? O chá de erva-doce tem a mesma substância que o medicamento TAMIFLU, o remédio usado para tratar a gripe A - HIN1. Aconselha-se tomar o chá como se fosse café, após as refeições.Recomenda-se tomar de 12 em 12/horas o chá de erva doce, pois ele mata o vírus da influenza. * Repasse para seus familiares e amigos, é muito importante! ISTO É FAKE NEWS! ESTA NOTÍCIA E FALSA - 09:36 Erva doce. 09:36 NÃO DIVUL bigite uma mensagem NÃO DMILGUE ",https://www.saude.gov.br/images/jpg/2020/janeiro/29/novo-coronavirus-fake-news1.jpg,1
83,https://www.saude.gov.br/component/content/article/1361-fake-news/45154-nova-gripe-fatal-e-cha-de-erva-doce-e-fake-news,2019-01-31 10:28:55,2019-01-31 10:28:55,Nova gripe fatal e chá de erva doce ,"Encaminhada Diretor do HC (Hospital das Clínicas) preocupado com a nova gripe que vai matar muita gente. Fazer do álcool gel o nossso aliado. Comecem a tomar vitamina C urgente, cuidem das crianças. Lavar as mãos muitas vezes. Orienta: - evitar ir a locais onde haja multidão; - tomar vitamina C; - comer figado de boi; - ingerir sucos de acerola e laranja. FÍGADO DE GALINHA Vamos repassar? ERVA-DOCE STERIO DA SAUDE A ISTO É O chá de erva-doce tem a mesma substância remédio que todas as vítimas da gripe A - H Uma médica, descobriu no seu laboratór famoso TAMIFLU, aparece no CHÁ DE E Aconselha-se tomar o chá como se foss FAKE Um infectologista do hospital São Dom 12/horas o chá de erva doce, ela mata o é feito o TAMIFLU. NEWS! * Repasse para seus famíliares e amigos pois e 08 1É FALSA - NÃO DIVULGUE ADVERTE ESTA NOTICIA ",https://www.saude.gov.br/images/png/2019/janeiro/31/FakeNews-ervadoce.png,1
